number,value,datetime_start,datetime_complete,duration,params_balance_strategy,params_batch_size,params_dropout,params_label_smoothing,params_lr,params_roi_frac,params_scheduler_factor,params_weight_decay,user_attrs_best_epoch,user_attrs_best_val_loss,user_attrs_best_val_patient_balanced_acc,user_attrs_best_val_patient_mcc,user_attrs_best_val_patient_roc_auc,user_attrs_best_val_patient_sensitivity,user_attrs_best_val_patient_specificity,user_attrs_checkpoint,user_attrs_command,user_attrs_duracion_min,user_attrs_log_path,user_attrs_run_name,user_attrs_wall_time_minutes,state
16,0.4720238095238095,2026-06-20 20:26:33.104288,2026-06-20 20:35:08.436217,0 days 00:08:35.331929,sampler,32,0.4,0.1,1.5846567638632683e-05,0.6,0.3,8.186227632600987e-05,1.0,0.6964337701054966,0.4697916666666667,-0.051357032652475,0.4720238095238095,0.5333333333333333,0.40625,/Users/luisazcoitipena/Desktop/Repo TFM/TFM-UNIR/models/optuna/resnet50_tfm_v1/optuna_resnet50_tfm_v1_trial_016_best.pth,'/Users/luisazcoitipena/Desktop/Repo TFM/TFM-UNIR/venv/bin/python' -u '/Users/luisazcoitipena/Desktop/Repo TFM/TFM-UNIR/src/training_loop.py' --model resnet50 --csv data_index.csv --images data/PPMI_Procesado_2D_Atlas --output-dir models/optuna/resnet50_tfm_v1 --excel resultados/optuna/resnet50_tfm_v1/resnet50_tfm_v1_training.xlsx --run-name optuna_resnet50_tfm_v1_trial_016 --epochs 15 --patience 5 --monitor val_patient_roc_auc --min-delta 0.001 --freeze layer4 --optimizer adamw --scheduler plateau --scheduler-patience 2 --scheduler-factor 0.3 --lr 1.5846567638632683e-05 --weight-decay 8.186227632600987e-05 --dropout 0.4 --label-smoothing 0.1 --balance-strategy sampler --batch-size 32 --roi-frac 0.6 --seed 42 --wandb,8.462791633605956,/Users/luisazcoitipena/Desktop/Repo TFM/TFM-UNIR/resultados/optuna/resnet50_tfm_v1/logs/trial_016.log,optuna_resnet50_tfm_v1_trial_016,8.588569553693135,COMPLETE
17,0.4726190476190476,2026-06-20 20:35:08.474775,2026-06-20 20:43:21.054062,0 days 00:08:12.579287,sampler,32,0.4,0.1,1.5382513176422807e-05,0.6,0.3,8.936373686873858e-05,1.0,0.6962190822963297,0.4697916666666667,-0.051357032652475,0.4726190476190476,0.5333333333333333,0.40625,/Users/luisazcoitipena/Desktop/Repo TFM/TFM-UNIR/models/optuna/resnet50_tfm_v1/optuna_resnet50_tfm_v1_trial_017_best.pth,'/Users/luisazcoitipena/Desktop/Repo TFM/TFM-UNIR/venv/bin/python' -u '/Users/luisazcoitipena/Desktop/Repo TFM/TFM-UNIR/src/training_loop.py' --model resnet50 --csv data_index.csv --images data/PPMI_Procesado_2D_Atlas --output-dir models/optuna/resnet50_tfm_v1 --excel resultados/optuna/resnet50_tfm_v1/resnet50_tfm_v1_training.xlsx --run-name optuna_resnet50_tfm_v1_trial_017 --epochs 15 --patience 5 --monitor val_patient_roc_auc --min-delta 0.001 --freeze layer4 --optimizer adamw --scheduler plateau --scheduler-patience 2 --scheduler-factor 0.3 --lr 1.5382513176422807e-05 --weight-decay 8.936373686873858e-05 --dropout 0.4 --label-smoothing 0.1 --balance-strategy sampler --batch-size 32 --roi-frac 0.6 --seed 42 --wandb,8.085756333669027,/Users/luisazcoitipena/Desktop/Repo TFM/TFM-UNIR/resultados/optuna/resnet50_tfm_v1/logs/trial_017.log,optuna_resnet50_tfm_v1_trial_017,8.209346600373586,COMPLETE
18,0.4770833333333333,2026-06-20 20:43:21.096254,2026-06-20 20:52:08.418096,0 days 00:08:47.321842,sampler,32,0.4,0.1,8.980455632612052e-06,0.6,0.3,9.562617641191289e-05,1.0,0.6948848667516035,0.5058035714285714,0.009853915499489491,0.4770833333333333,0.5428571428571428,0.46875,/Users/luisazcoitipena/Desktop/Repo TFM/TFM-UNIR/models/optuna/resnet50_tfm_v1/optuna_resnet50_tfm_v1_trial_018_best.pth,'/Users/luisazcoitipena/Desktop/Repo TFM/TFM-UNIR/venv/bin/python' -u '/Users/luisazcoitipena/Desktop/Repo TFM/TFM-UNIR/src/training_loop.py' --model resnet50 --csv data_index.csv --images data/PPMI_Procesado_2D_Atlas --output-dir models/optuna/resnet50_tfm_v1 --excel resultados/optuna/resnet50_tfm_v1/resnet50_tfm_v1_training.xlsx --run-name optuna_resnet50_tfm_v1_trial_018 --epochs 15 --patience 5 --monitor val_patient_roc_auc --min-delta 0.001 --freeze layer4 --optimizer adamw --scheduler plateau --scheduler-patience 2 --scheduler-factor 0.3 --lr 8.980455632612052e-06 --weight-decay 9.562617641191289e-05 --dropout 0.4 --label-smoothing 0.1 --balance-strategy sampler --batch-size 32 --roi-frac 0.6 --seed 42 --wandb,8.666361983617147,/Users/luisazcoitipena/Desktop/Repo TFM/TFM-UNIR/resultados/optuna/resnet50_tfm_v1/logs/trial_018.log,optuna_resnet50_tfm_v1_trial_018,8.788390298684439,COMPLETE
19,0.4529761904761905,2026-06-20 20:52:08.451953,2026-06-20 21:02:16.905639,0 days 00:10:08.453686,class_weights,32,0.4,0.1,8.342886998136055e-06,0.6,0.5,0.00010557329270626568,2.0,0.7275171236690233,0.4633928571428572,-0.0916971283374683,0.4529761904761905,0.1142857142857143,0.8125,/Users/luisazcoitipena/Desktop/Repo TFM/TFM-UNIR/models/optuna/resnet50_tfm_v1/optuna_resnet50_tfm_v1_trial_019_best.pth,'/Users/luisazcoitipena/Desktop/Repo TFM/TFM-UNIR/venv/bin/python' -u '/Users/luisazcoitipena/Desktop/Repo TFM/TFM-UNIR/src/training_loop.py' --model resnet50 --csv data_index.csv --images data/PPMI_Procesado_2D_Atlas --output-dir models/optuna/resnet50_tfm_v1 --excel resultados/optuna/resnet50_tfm_v1/resnet50_tfm_v1_training.xlsx --run-name optuna_resnet50_tfm_v1_trial_019 --epochs 15 --patience 5 --monitor val_patient_roc_auc --min-delta 0.001 --freeze layer4 --optimizer adamw --scheduler plateau --scheduler-patience 2 --scheduler-factor 0.5 --lr 8.342886998136055e-06 --weight-decay 0.00010557329270626568 --dropout 0.4 --label-smoothing 0.1 --balance-strategy class_weights --batch-size 32 --roi-frac 0.6 --seed 42 --wandb,10.00844740072886,/Users/luisazcoitipena/Desktop/Repo TFM/TFM-UNIR/resultados/optuna/resnet50_tfm_v1/logs/trial_019.log,optuna_resnet50_tfm_v1_trial_019,10.140586495399475,COMPLETE
